================================================================================
🔄 5-FOLD CROSS-VALIDATION - CHALLENGE 1
================================================================================
/home/kevin/.local/lib/python3.12/site-packages/pandas/core/arrays/masked.py:61: UserWarning: Pandas requires version '1.3.6' or newer of 'bottleneck' (version '1.3.5' currently installed).
  from pandas.core import (
================================================================================
🎯 CHALLENGE 1: RESPONSE TIME PREDICTION (CCD TASK)
================================================================================
Competition: https://eeg2025.github.io/
Metric: NRMSE (target < 0.5)
Device: CPU
================================================================================

📂 Loading dataset...

📋 Loading CCD data...
   Found 20 subjects
/home/kevin/.local/lib/python3.12/site-packages/matplotlib/projections/__init__.py:63: UserWarning: Unable to import Axes3D. This may be due to multiple versions of Matplotlib being installed (e.g. as a system package and as a pip package). As a result, the 3D projection is not available.
  warnings.warn("Unable to import Axes3D. This may be due to multiple versions of "
   ✅ sub-NDARAH793FBF/sub-NDARAH793FBF_task-contrastChangeDetection_run-1_eeg.bdf: 25 trials
   ✅ sub-NDARAH793FBF/sub-NDARAH793FBF_task-contrastChangeDetection_run-2_eeg.bdf: 25 trials
   ✅ sub-NDARAH793FBF/sub-NDARAH793FBF_task-contrastChangeDetection_run-3_eeg.bdf: 25 trials
   ✅ sub-NDARAJ689BVN/sub-NDARAJ689BVN_task-contrastChangeDetection_run-1_eeg.bdf: 25 trials
   ✅ sub-NDARAJ689BVN/sub-NDARAJ689BVN_task-contrastChangeDetection_run-3_eeg.bdf: 25 trials
   ✅ sub-NDARAJ689BVN/sub-NDARAJ689BVN_task-contrastChangeDetection_run-2_eeg.bdf: 25 trials
   ✅ sub-NDARAP785CTE/sub-NDARAP785CTE_task-contrastChangeDetection_run-3_eeg.bdf: 25 trials
   ✅ sub-NDARAP785CTE/sub-NDARAP785CTE_task-contrastChangeDetection_run-2_eeg.bdf: 25 trials
   ✅ sub-NDARAP785CTE/sub-NDARAP785CTE_task-contrastChangeDetection_run-1_eeg.bdf: 25 trials
   ✅ sub-NDARAU708TL8/sub-NDARAU708TL8_task-contrastChangeDetection_run-3_eeg.bdf: 25 trials
   ✅ sub-NDARAU708TL8/sub-NDARAU708TL8_task-contrastChangeDetection_run-2_eeg.bdf: 25 trials
   ✅ sub-NDARAU708TL8/sub-NDARAU708TL8_task-contrastChangeDetection_run-1_eeg.bdf: 25 trials
   ✅ sub-NDARBE091BGD/sub-NDARBE091BGD_task-contrastChangeDetection_run-1_eeg.bdf: 25 trials
   ✅ sub-NDARBE091BGD/sub-NDARBE091BGD_task-contrastChangeDetection_run-2_eeg.bdf: 25 trials
   ✅ sub-NDARBE091BGD/sub-NDARBE091BGD_task-contrastChangeDetection_run-3_eeg.bdf: 25 trials
   ✅ sub-NDARBE103DHM/sub-NDARBE103DHM_task-contrastChangeDetection_run-1_eeg.bdf: 25 trials
   ✅ sub-NDARBE103DHM/sub-NDARBE103DHM_task-contrastChangeDetection_run-2_eeg.bdf: 25 trials
   ✅ sub-NDARBE103DHM/sub-NDARBE103DHM_task-contrastChangeDetection_run-3_eeg.bdf: 25 trials
   ✅ sub-NDARBF851NH6/sub-NDARBF851NH6_task-contrastChangeDetection_run-1_eeg.bdf: 25 trials
   ✅ sub-NDARBF851NH6/sub-NDARBF851NH6_task-contrastChangeDetection_run-2_eeg.bdf: 25 trials
   ✅ sub-NDARBF851NH6/sub-NDARBF851NH6_task-contrastChangeDetection_run-3_eeg.bdf: 25 trials
   ✅ sub-NDARBH228RDW/sub-NDARBH228RDW_task-contrastChangeDetection_run-1_eeg.bdf: 25 trials
   ✅ sub-NDARBH228RDW/sub-NDARBH228RDW_task-contrastChangeDetection_run-3_eeg.bdf: 25 trials
   ✅ sub-NDARBH228RDW/sub-NDARBH228RDW_task-contrastChangeDetection_run-2_eeg.bdf: 25 trials
   ✅ sub-NDARBJ674TVU/sub-NDARBJ674TVU_task-contrastChangeDetection_run-1_eeg.bdf: 25 trials
   ✅ sub-NDARBJ674TVU/sub-NDARBJ674TVU_task-contrastChangeDetection_run-2_eeg.bdf: 25 trials
   ✅ sub-NDARBJ674TVU/sub-NDARBJ674TVU_task-contrastChangeDetection_run-3_eeg.bdf: 25 trials
   ✅ sub-NDARBM433VER/sub-NDARBM433VER_task-contrastChangeDetection_run-3_eeg.bdf: 25 trials
   ✅ sub-NDARBM433VER/sub-NDARBM433VER_task-contrastChangeDetection_run-1_eeg.bdf: 25 trials
   ✅ sub-NDARBM433VER/sub-NDARBM433VER_task-contrastChangeDetection_run-2_eeg.bdf: 25 trials
   ✅ sub-NDARCA740UC8/sub-NDARCA740UC8_task-contrastChangeDetection_run-3_eeg.bdf: 25 trials
   ✅ sub-NDARCA740UC8/sub-NDARCA740UC8_task-contrastChangeDetection_run-1_eeg.bdf: 25 trials
   ✅ sub-NDARCA740UC8/sub-NDARCA740UC8_task-contrastChangeDetection_run-2_eeg.bdf: 25 trials
   ✅ sub-NDARCU633GCZ/sub-NDARCU633GCZ_task-contrastChangeDetection_run-2_eeg.bdf: 25 trials
   ✅ sub-NDARCU633GCZ/sub-NDARCU633GCZ_task-contrastChangeDetection_run-3_eeg.bdf: 25 trials
   ✅ sub-NDARCU633GCZ/sub-NDARCU633GCZ_task-contrastChangeDetection_run-1_eeg.bdf: 25 trials
   ✅ sub-NDARCU736GZ1/sub-NDARCU736GZ1_task-contrastChangeDetection_run-2_eeg.bdf: 25 trials
   ✅ sub-NDARCU736GZ1/sub-NDARCU736GZ1_task-contrastChangeDetection_run-3_eeg.bdf: 25 trials
   ✅ sub-NDARCU736GZ1/sub-NDARCU736GZ1_task-contrastChangeDetection_run-1_eeg.bdf: 25 trials
   ✅ sub-NDARCU744XWL/sub-NDARCU744XWL_task-contrastChangeDetection_run-2_eeg.bdf: 25 trials
   ✅ sub-NDARCU744XWL/sub-NDARCU744XWL_task-contrastChangeDetection_run-1_eeg.bdf: 25 trials
   ✅ sub-NDARCU744XWL/sub-NDARCU744XWL_task-contrastChangeDetection_run-3_eeg.bdf: 25 trials
   ✅ sub-NDARDC843HHM/sub-NDARDC843HHM_task-contrastChangeDetection_run-3_eeg.bdf: 25 trials
   ✅ sub-NDARDC843HHM/sub-NDARDC843HHM_task-contrastChangeDetection_run-1_eeg.bdf: 25 trials
   ✅ sub-NDARDC843HHM/sub-NDARDC843HHM_task-contrastChangeDetection_run-2_eeg.bdf: 25 trials
   ✅ sub-NDARDH086ZKK/sub-NDARDH086ZKK_task-contrastChangeDetection_run-2_eeg.bdf: 25 trials
   ✅ sub-NDARDH086ZKK/sub-NDARDH086ZKK_task-contrastChangeDetection_run-1_eeg.bdf: 25 trials
   ✅ sub-NDARDH086ZKK/sub-NDARDH086ZKK_task-contrastChangeDetection_run-3_eeg.bdf: 25 trials
   ✅ sub-NDARDL305BT8/sub-NDARDL305BT8_task-contrastChangeDetection_run-1_eeg.bdf: 25 trials

📊 Total segments: 420
   Response Time: mean=3.545s, std=1.552s
   Range: [0.100, 4.980]s
   Total samples: 420

🔄 Running 5-fold cross-validation...
================================================================================

 Fold 1/5
   Train samples: 336
   Val samples: 84
   🔥 Training... ✓ (2.5s)
   📊 Best NRMSE: 1.2900
   ⚠️  Above target (0.5)

 Fold 2/5
   Train samples: 336
   Val samples: 84
   🔥 Training... ✓ (1.8s)
   📊 Best NRMSE: 0.9855
   ⚠️  Above target (0.5)

 Fold 3/5
   Train samples: 336
   Val samples: 84
   🔥 Training... ✓ (1.2s)
   📊 Best NRMSE: 1.0086
   ⚠️  Above target (0.5)

 Fold 4/5
   Train samples: 336
   Val samples: 84
   🔥 Training... ✓ (1.5s)
   📊 Best NRMSE: 0.9507
   ⚠️  Above target (0.5)

 Fold 5/5
   Train samples: 336
   Val samples: 84
   🔥 Training... ✓ (1.0s)
   📊 Best NRMSE: 1.0305
   ⚠️  Above target (0.5)

================================================================================
📊 CROSS-VALIDATION RESULTS
================================================================================

Fold Results:
   Fold 1: 1.2900 ⚠️
   Fold 2: 0.9855 ⚠️
   Fold 3: 1.0086 ⚠️
   Fold 4: 0.9507 ⚠️
   Fold 5: 1.0305 ⚠️

📈 Statistics:
   Mean NRMSE: 1.0530
   Std NRMSE:  0.1214
   Min NRMSE:  0.9507
   Max NRMSE:  1.2900

️  Total time: 0.3 minutes

💾 Results saved to: results/challenge1_crossval.txt

⚠️  Model needs improvement: Mean NRMSE 1.0530 > 0.5

================================================================================
✅ CROSS-VALIDATION COMPLETE!
================================================================================
